{
  "schemaVersion": 3,
  "policyVersion": "perf05-db-campaign-v1",
  "campaignId": "perf05-medium-20261007-main32-amd9v45-assignment-v1",
  "createdAtUtc": "2026-10-07T08:55:41Z",
  "expiresAtUtc": "2026-10-10T08:55:41Z",
  "profile": "medium",
  "environmentCompatibilityDigest": "e3fd3025c8dd91dc45f3447350915f978ee1e9e6555264a5456b65b4896a0095",
  "sourceSha": "32a17bde8f7f21ab8670265ae75d21ed081e27b9",
  "sourceRef": "refs/heads/main",
  "fixtureIdentity": {
    "profile": "medium",
    "hash": "7dfa25e30fb7f87cd1457400171b75c0374713279bee3a4bc429a5d9fba7ca96",
    "version": 2,
    "manifestSha256": "86b179dcae9748c3157f1775cf5e9cc432ab5030c90b1dd1161c7007a4c22772"
  },
  "toolVersions": {
    "dotnetRuntime": "Host:\n  Version:      10.0.12\n  Architecture: x64\n  Commit:       95017c711e\n  RID:          linux-x64\n\n.NET SDKs installed:\n  No SDKs were found.\n\n.NET runtimes installed:\n  Microsoft.AspNetCore.App 10.0.12 [/usr/share/dotnet/shared/Microsoft.AspNetCore.App]\n  Microsoft.NETCore.App 10.0.12 [/usr/share/dotnet/shared/Microsoft.NETCore.App]\n\nOther architectures found:\n  None\n\nEnvironment variables:\n  DOTNET_RUNNING_IN_CONTAINER              [true]\n  DOTNET_VERSION                           [10.0.12]\n\nglobal.json file:\n  Not found\n\nLearn more:\n  https://aka.ms/dotnet/info\n\nDownload .NET:\n  https://aka.ms/dotnet/download",
    "node": "v24.20.0",
    "postgresql": "18.6",
    "playwright": "1.63.0",
    "browser": "Google Chrome for Testing 153.0.8010.12"
  },
  "toolSourceDigests": {
    "scripts/performance/db-probe.py": "a1ab568f49b84ec45a7392bf0e204f8dab0c913c699978f70efb606d7a1ff84f",
    "scripts/performance/db_gate.py": "fce4c1617b28a7b5bdf842218fcc7449b5c141d464724bed7e448984823ca451",
    "scripts/performance/db-compare.py": "4f49153bf0abbce6dfbc581ec3df1cbfe11657d17c5ab38351a8aa548beafa0d",
    "scripts/performance/compare.py": "5142d5a52da773c460637b25a85168242565d69ff7d103270d24a11a32d4cd91",
    "scripts/performance/common.py": "4117639c8cce8976e42d164145c72b3674feab8769890719a3d6ec9a6323bf21",
    "scripts/performance/collect-environment.py": "4d0123823840ac6fc5a8e7dc1798de23dc766181310ef4f7aa9756eac3c8f7a8",
    "scripts/performance/with-environment.sh": "357818b0f8454170c3d985647b7a805ed336ed8421420fd0756bc800d27c9733",
    "src/Coglatas.Infrastructure/Persistence/PerformanceDbCapture.cs": "889625723d1b781d3ed622e4dfe4e91c449161e98b7934e15065dbd0acddd699"
  },
  "contractDigests": {
    "performance/datasets.json": "86b179dcae9748c3157f1775cf5e9cc432ab5030c90b1dd1161c7007a4c22772",
    "performance/db-scenarios.json": "12bf60a2837eb4052852bb03a6827e2fc7368caf85b7c6eefdba33f2aaa77f70",
    "performance/environment.json": "609adc953c3b232337e5bda8e5fd8637f533ced0c9c490730513b02701966be4",
    "performance/scenarios.json": "cdd96a0106e4af47f400ba4c738cd0b0cbcef3c397785c2142411e34a8b4d167",
    "performance/budgets.json": "580b10e4f2107a443d0052ab41c07fe5986982f54a2f454acfe41470f4175655",
    "performance/comparison-policy.json": "753119f067dbefb49adcbbfd4c959aae5612c5adc00eb232469d745181b9c9b3"
  },
  "scenarioSet": [
    {
      "scenario": "workspace.list",
      "pageSize": 0,
      "metric": "db.total_time_ms",
      "unit": "ms"
    },
    {
      "scenario": "project.list",
      "pageSize": 5,
      "metric": "db.total_time_ms",
      "unit": "ms"
    },
    {
      "scenario": "task.list",
      "pageSize": 5,
      "metric": "db.total_time_ms",
      "unit": "ms"
    },
    {
      "scenario": "task.my-tasks",
      "pageSize": 5,
      "metric": "db.total_time_ms",
      "unit": "ms"
    },
    {
      "scenario": "file.list",
      "pageSize": 5,
      "metric": "db.total_time_ms",
      "unit": "ms"
    },
    {
      "scenario": "conversation.list",
      "pageSize": 5,
      "metric": "db.total_time_ms",
      "unit": "ms"
    },
    {
      "scenario": "conversation.messages",
      "pageSize": 5,
      "metric": "db.total_time_ms",
      "unit": "ms"
    },
    {
      "scenario": "notification.list",
      "pageSize": 5,
      "metric": "db.total_time_ms",
      "unit": "ms"
    },
    {
      "scenario": "announcement.list",
      "pageSize": 5,
      "metric": "db.total_time_ms",
      "unit": "ms"
    }
  ],
  "sampleCount": 5,
  "maxCaptureGroups": 3,
  "stabilityRule": {
    "indicator": "relative-mad",
    "maximum": 0.2,
    "comparatorSha256": "5142d5a52da773c460637b25a85168242565d69ff7d103270d24a11a32d4cd91"
  },
  "selectionAlgorithm": "earliest-eligible-stable-complete",
  "earlyStopPolicy": "never",
  "eligibilityRule": "exact-source-environment-fixture-toolchain-complete-structural-pass",
  "authorization": {
    "approver": "NYGsatoshi",
    "reference": "https://github.com/NYGsatoshi/Coglatas/issues/606#issuecomment-6034448645",
    "reason": "One prospective direct environment assignment under perf05-environment-assignment-v1, based only on the entire consistent canonical environment identity across the exhausted predecessor's three ordinarily assigned groups. Predecessor canonical manifest SHA-256 0bc9a6442350949d0c5e4b2c46058f9e178d6de4be6e5d70327e3e7083100bf5; metadata artifact 11411415134 ZIP SHA-256 c6b94255290193cbad401be2f970db4cc396e0829293cfeb346115d063d8b6bf. Qualified current Main authority de46efbcadb4828b68ce14e4b3d263af7d1a4331. Measured source, fixture, tools, comparator, contracts, scenario order, samples and capture bounds are unchanged. All predecessor groups remain permanently rejected; timing and MAD do not choose the target. No host search, runner manipulation, result enrollment or prior approval transfer. This declaration requires new exact owner premeasurement approval; its fixed reference is NOT approval and no measurement is authorized.",
    "cause": "environment-assignment-transition",
    "supersedesCampaignId": "perf05-medium-20261006-main32-intel8370c-publicdigest"
  },
  "environmentAssignmentTransition": {
    "ruleVersion": "perf05-environment-assignment-v1",
    "ruleSourceSha": "361bf453b0ddc53af98fe790b30b83b683e81205",
    "ruleApprovalReference": "https://github.com/NYGsatoshi/Coglatas/issues/1105#issuecomment-6016721971",
    "predecessorArtifact": {
      "id": 11411325219,
      "name": "perf05-campaign-perf05-medium-20261006-main32-intel8370c-publicdigest",
      "digest": "sha256:7726ef3617a2d1452b977ce95ff51cf3a31ceef60315a97eded8ec7a1efd1bdf",
      "workflowRunId": 37457509298
    },
    "predecessorRawGroupsSha256": "dabfb4634c28f3ac399901466c081b39c48a2707f778adfb04737462a6670e0a"
  }
}
